{
  "schema": "metadax.provenance/0.2",
  "node_id": "L02.M02.O01/why-action-reaction-dont-cancel",
  "content_hash": "009d43612251b1664dffa6704796c22bc866eb0de66e4d1c9dc934f49c478bc3",
  "created_by": {
    "id": "author-e05",
    "key_id": null,
    "chain_role": "author"
  },
  "lineage": [
    {
      "node_id": "L02.M02.O01",
      "relation": "parent"
    }
  ],
  "constraints": {
    "constraint_decl_ref": null
  },
  "spec_version": "0.2",
  "ts": "2026-09-28T00:22:58Z"
}
