{
  "schema": "metadax.provenance/0.2",
  "node_id": "L02.M01.O01/mass-versus-weight",
  "content_hash": "3825f56e8ec9f18deabbb9bf82fc8a9fbeb2bb3f861d2ce850b8f7020f7a5c7b",
  "created_by": {
    "id": "author-e05",
    "key_id": null,
    "chain_role": "author"
  },
  "lineage": [
    {
      "node_id": "L02.M01.O01",
      "relation": "parent"
    }
  ],
  "constraints": {
    "constraint_decl_ref": null
  },
  "spec_version": "0.2",
  "ts": "2026-09-28T00:22:59Z"
}
