{
  "schema": "metadax.provenance/0.2",
  "node_id": "L01.M01.O01/adding-forces-different-directions",
  "content_hash": "00c0899cd4c36c27a1e85a704e73bb44409b8a80f399622f84547f3cefb82ccf",
  "created_by": {
    "id": "author-e05",
    "key_id": null,
    "chain_role": "author"
  },
  "lineage": [
    {
      "node_id": "L01.M01.O01",
      "relation": "parent"
    }
  ],
  "constraints": {
    "constraint_decl_ref": null
  },
  "spec_version": "0.2",
  "ts": "2026-09-28T00:22:58Z"
}
