{
  "schema": "metadax.provenance/0.2",
  "node_id": "L01.M06.O05",
  "content_hash": "runtime",
  "created_by": {
    "id": "lrn-mira01",
    "key_id": null,
    "chain_role": "learner"
  },
  "lineage": [],
  "constraints": {
    "constraint_decl_ref": null
  },
  "spec_version": "0.2",
  "ts": "runtime"
}