{
  "schema": "metadax.provenance/0.2",
  "node_id": "L01.M01.O02",
  "content_hash": "be86286f7ba95417eb1d91a278c8923a6dc91eb9b81350700bf3dbee6f123605",
  "created_by": {
    "id": "author-sbx01",
    "key_id": null,
    "chain_role": "author"
  },
  "lineage": [],
  "constraints": {
    "constraint_decl_ref": null
  },
  "spec_version": "0.2",
  "ts": "2026-09-27T20:12:01Z"
}
