{
  "schema": "metadax.provenance/0.2",
  "node_id": "L02.M01.O01/fma-with-multiple-forces",
  "content_hash": "05ceafca34baeacc3c958e32c1e3d894b12d117138273c6411e87bdbebf886a1",
  "created_by": {
    "id": "author-e05",
    "key_id": null,
    "chain_role": "author"
  },
  "lineage": [
    {
      "node_id": "L02.M01.O01",
      "relation": "parent"
    }
  ],
  "constraints": {
    "constraint_decl_ref": null
  },
  "spec_version": "0.2",
  "ts": "2026-09-28T00:22:58Z"
}
