{
  "schema": "metadax.provenance/0.2",
  "node_id": "n_csq1p3287m0yyh5wv98ssnjjzg",
  "content_hash": "0bd05fed9d863e58297575093775da247779c017e43c5337ffb5590ec4aad640",
  "created_by": {
    "id": "author-e05",
    "key_id": null,
    "chain_role": "author"
  },
  "lineage": [
    {
      "node_id": "L01.M01.O01",
      "relation": "parent"
    }
  ],
  "constraints": {
    "constraint_decl_ref": null
  },
  "spec_version": "0.2",
  "ts": "2026-09-28T00:22:58Z"
}
