{
  "schema": "metadax.provenance/0.2",
  "node_id": "n_bwgqx5js2z3zb2a0d3hpny2sw0",
  "content_hash": "3025dc33ae7a868fc6fa3eb0b52a45c1507087c61b840e9146e5dc26cf94d64e",
  "created_by": {
    "id": "author-e05",
    "key_id": null,
    "chain_role": "author"
  },
  "lineage": [
    {
      "node_id": "L01.M01.O01",
      "relation": "parent"
    }
  ],
  "constraints": {
    "constraint_decl_ref": null
  },
  "spec_version": "0.2",
  "ts": "2026-09-28T00:22:58Z"
}
