{
  "schema": "metadax.provenance/0.2",
  "node_id": "L02.M01.O01/solving-fma-for-a",
  "content_hash": "074b36a561c254309eeffd7236acdb05650ab4912c74a34e90782d8bcaad604a",
  "created_by": {
    "id": "author-e05",
    "key_id": null,
    "chain_role": "author"
  },
  "lineage": [
    {
      "node_id": "L02.M01.O01",
      "relation": "parent"
    }
  ],
  "constraints": {
    "constraint_decl_ref": null
  },
  "spec_version": "0.2",
  "ts": "2026-09-28T00:22:58Z"
}
