{
  "schema": "metadax.provenance/0.2",
  "node_id": "n_6yv1famfjzpjw8gt1gc9s6fqz4",
  "content_hash": "f185ac3abbe37affb63d0aa82b073d33dce6c66a4958c27128a59666546ebc7f",
  "created_by": {
    "id": "author-e05",
    "key_id": null,
    "chain_role": "author"
  },
  "lineage": [
    {
      "node_id": "L01.M02.O02",
      "relation": "parent"
    }
  ],
  "constraints": {
    "constraint_decl_ref": null
  },
  "spec_version": "0.2",
  "ts": "2026-09-28T00:22:59Z"
}
