{
  "schema": "metadax.provenance/0.2",
  "node_id": "L01.M01.O02/why-velocity-is-a-vector",
  "content_hash": "246b1d90188596db60bdffa223c56d55edf8b57ca64dac4494ceeb65e8b7abb1",
  "created_by": {
    "id": "author-e05",
    "key_id": null,
    "chain_role": "author"
  },
  "lineage": [
    {
      "node_id": "L01.M01.O02",
      "relation": "parent"
    }
  ],
  "constraints": {
    "constraint_decl_ref": null
  },
  "spec_version": "0.2",
  "ts": "2026-09-28T00:22:59Z"
}
