{
  "schema": "metadax.provenance/0.2",
  "node_id": "L02.M01.O02/acceleration-of-two-connected-blocks",
  "content_hash": "699529dd18ffcbec22820b631498bdcfb0becfcd31d4a66e691fa2c83a4caa5a",
  "created_by": {
    "id": "author-e05",
    "key_id": null,
    "chain_role": "author"
  },
  "lineage": [
    {
      "node_id": "L02.M01.O02",
      "relation": "parent"
    }
  ],
  "constraints": {
    "constraint_decl_ref": null
  },
  "spec_version": "0.2",
  "ts": "2026-09-28T00:22:59Z"
}
