{
  "schema": "metadax.provenance/0.2",
  "node_id": "n_bpyme6z9ra5zvxk7yxn6ayyt8m",
  "content_hash": "0230aeca6bd9ed6ef26879173be64f6198b2770e2531fe89f4a0d1d156200dab",
  "created_by": {
    "id": "author-e05",
    "key_id": null,
    "chain_role": "author"
  },
  "lineage": [
    {
      "node_id": "L02.M01.O01",
      "relation": "parent"
    }
  ],
  "constraints": {
    "constraint_decl_ref": null
  },
  "spec_version": "0.2",
  "ts": "2026-09-28T00:22:59Z"
}
