{
  "schema": "metadax.provenance/0.2",
  "node_id": "L02.M01.O01/the-newton-as-a-unit",
  "content_hash": "d58971d56911475fff5f70141f98c9bd7629aa98f5aa60d0a8f25ceb23584067",
  "created_by": {
    "id": "author-e05",
    "key_id": null,
    "chain_role": "author"
  },
  "lineage": [
    {
      "node_id": "L02.M01.O01",
      "relation": "parent"
    }
  ],
  "constraints": {
    "constraint_decl_ref": null
  },
  "spec_version": "0.2",
  "ts": "2026-09-28T00:22:59Z"
}
