{
  "schema": "metadax.provenance/0.2",
  "node_id": "L01.M02.O02/why-earth-is-nearly-inertial",
  "content_hash": "1b0c3d931ded04fca12625f9997a1e0637f0ff867b7342f7c536efe3d1786d82",
  "created_by": {
    "id": "author-e05",
    "key_id": null,
    "chain_role": "author"
  },
  "lineage": [
    {
      "node_id": "L01.M02.O02",
      "relation": "parent"
    }
  ],
  "constraints": {
    "constraint_decl_ref": null
  },
  "spec_version": "0.2",
  "ts": "2026-09-28T00:22:59Z"
}
