{
  "schema": "metadax.provenance/0.2",
  "node_id": "n_r5p1aj6pb0kw5tn90vdpphmfcw",
  "content_hash": "27993869c77bab698b1321861373eb47f9346d6ddcd17aa4df081b26934e37c2",
  "created_by": {
    "id": "author-e05",
    "key_id": null,
    "chain_role": "author"
  },
  "lineage": [
    {
      "node_id": "L01.M02.O01",
      "relation": "parent"
    }
  ],
  "constraints": {
    "constraint_decl_ref": null
  },
  "spec_version": "0.2",
  "ts": "2026-09-28T00:22:58Z"
}
